{
  "$schema": "https://json-schema.org/draft/2020-12/schema",
  "$id": "https://historical-video-studio.local/contracts/StoryPackage.v1.schema.json",
  "title": "StoryPackage.v1",
  "type": "object",
  "additionalProperties": false,
  "properties": {
    "schema_version": {
      "const": "StoryPackage.v1"
    },
    "project": {
      "type": "object",
      "additionalProperties": false,
      "properties": {
        "project_id": {
          "type": "string",
          "pattern": "^[A-Za-z][A-Za-z0-9_-]{2,63}$"
        },
        "title": {
          "type": "string",
          "minLength": 1
        },
        "language": {
          "const": "en"
        },
        "style_id": {
          "const": "HistoryEditorialPaper.v1"
        }
      },
      "required": [
        "project_id",
        "title",
        "language",
        "style_id"
      ]
    },
    "sections": {
      "type": "array",
      "items": {
        "type": "object",
        "additionalProperties": false,
        "properties": {
          "section_id": {
            "type": "string",
            "pattern": "^[A-Za-z][A-Za-z0-9_-]{2,63}$"
          },
          "narration": {
            "type": "string",
            "minLength": 10
          },
          "claim_refs": {
            "type": "array",
            "items": {
              "type": "string",
              "pattern": "^[A-Za-z][A-Za-z0-9_-]{2,63}$"
            },
            "minItems": 0
          },
          "asset_requirement_refs": {
            "type": "array",
            "items": {
              "type": "string",
              "pattern": "^[A-Za-z][A-Za-z0-9_-]{2,63}$"
            },
            "minItems": 0
          }
        },
        "required": [
          "section_id",
          "narration",
          "claim_refs",
          "asset_requirement_refs"
        ]
      },
      "minItems": 1
    },
    "claims": {
      "type": "array",
      "items": {
        "type": "object",
        "additionalProperties": false,
        "properties": {
          "claim_id": {
            "type": "string",
            "pattern": "^[A-Za-z][A-Za-z0-9_-]{2,63}$"
          },
          "text": {
            "type": "string",
            "minLength": 1
          },
          "source_leads": {
            "type": "array",
            "items": {
              "type": "object",
              "additionalProperties": false,
              "properties": {
                "url": {
                  "type": "string",
                  "format": "uri",
                  "pattern": "^https?://"
                },
                "title": {
                  "type": "string"
                }
              },
              "required": [
                "url"
              ]
            },
            "minItems": 0
          },
          "critical": {
            "type": "boolean"
          },
          "status": {
            "type": "string",
            "enum": [
              "UNVERIFIED",
              "REVIEWED",
              "VERIFIED"
            ]
          }
        },
        "required": [
          "claim_id",
          "text",
          "source_leads",
          "critical",
          "status"
        ]
      },
      "minItems": 0
    },
    "asset_requirements": {
      "type": "array",
      "items": {
        "type": "object",
        "additionalProperties": false,
        "properties": {
          "requirement_id": {
            "type": "string",
            "pattern": "^[A-Za-z][A-Za-z0-9_-]{2,63}$"
          },
          "subject": {
            "type": "string",
            "minLength": 1
          },
          "asset_class": {
            "type": "string",
            "enum": [
              "ARCHIVAL_PHOTO",
              "HISTORICAL_DOCUMENT",
              "HISTORICAL_ARTWORK",
              "HISTORICAL_MAP",
              "MODERN_RECONSTRUCTION",
              "AI_ILLUSTRATION"
            ]
          },
          "exactness": {
            "type": "string",
            "enum": [
              "event_exact",
              "subject_exact",
              "context_related",
              "illustrative"
            ]
          },
          "required": {
            "type": "boolean"
          },
          "start_year": {
            "type": "integer"
          },
          "end_year": {
            "type": "integer"
          },
          "source_leads": {
            "type": "array",
            "items": {
              "type": "object",
              "additionalProperties": false,
              "properties": {
                "url": {
                  "type": "string",
                  "format": "uri",
                  "pattern": "^https?://"
                },
                "title": {
                  "type": "string"
                }
              },
              "required": [
                "url"
              ]
            },
            "minItems": 0
          },
          "map_reconstruction_policy": {
            "type": "string",
            "enum": [
              "exact_period_map",
              "verified_schematic",
              "not_applicable"
            ]
          }
        },
        "required": [
          "requirement_id",
          "subject",
          "asset_class",
          "exactness",
          "required",
          "start_year",
          "end_year",
          "map_reconstruction_policy"
        ]
      },
      "minItems": 0
    },
    "visual_setups": {
      "type": "array",
      "items": {
        "type": "object",
        "additionalProperties": false,
        "properties": {
          "setup_id": {
            "type": "string",
            "pattern": "^[A-Za-z][A-Za-z0-9_-]{2,63}$"
          },
          "section_refs": {
            "type": "array",
            "items": {
              "type": "string",
              "pattern": "^[A-Za-z][A-Za-z0-9_-]{2,63}$"
            },
            "minItems": 1
          },
          "intent": {
            "type": "string",
            "enum": [
              "geography",
              "person",
              "evidence",
              "route",
              "chronology",
              "number",
              "quote",
              "consequence"
            ]
          },
          "preferred_template": {
            "type": "string",
            "enum": [
              "T01",
              "T02",
              "T03",
              "T04",
              "T05",
              "T06",
              "T07",
              "T08",
              "T09",
              "T10"
            ]
          },
          "requirement_refs": {
            "type": "array",
            "items": {
              "type": "string",
              "pattern": "^[A-Za-z][A-Za-z0-9_-]{2,63}$"
            },
            "minItems": 0
          },
          "claim_refs": {
            "type": "array",
            "items": {
              "type": "string",
              "pattern": "^[A-Za-z][A-Za-z0-9_-]{2,63}$"
            },
            "minItems": 0
          },
          "direction": {
            "type": "object",
            "additionalProperties": false,
            "properties": {
              "visual_purpose": {
                "type": "string",
                "minLength": 1,
                "maxLength": 450
              },
              "viewer_takeaway": {
                "type": "string",
                "minLength": 1,
                "maxLength": 450
              },
              "on_screen_text": {
                "type": "array",
                "items": {
                  "type": "object",
                  "additionalProperties": false,
                  "properties": {
                    "text": {
                      "type": "string",
                      "minLength": 1,
                      "maxLength": 260
                    },
                    "role": {
                      "type": "string",
                      "enum": [
                        "headline",
                        "date",
                        "quote",
                        "caption",
                        "source",
                        "map_label"
                      ]
                    },
                    "claim_ref": {
                      "anyOf": [
                        {
                          "type": "string",
                          "pattern": "^[A-Za-z][A-Za-z0-9_-]{2,63}$"
                        },
                        {
                          "type": "null"
                        }
                      ]
                    },
                    "max_lines": {
                      "type": "integer",
                      "minimum": 1,
                      "maximum": 5
                    }
                  },
                  "required": [
                    "text",
                    "role",
                    "claim_ref"
                  ]
                },
                "minItems": 0
              },
              "reveal_plan": {
                "type": "array",
                "items": {
                  "type": "object",
                  "additionalProperties": false,
                  "properties": {
                    "beat_id": {
                      "type": "string",
                      "pattern": "^[A-Za-z][A-Za-z0-9_-]{2,63}$"
                    },
                    "action": {
                      "type": "string",
                      "enum": [
                        "establish",
                        "introduce",
                        "highlight",
                        "compare",
                        "move",
                        "hold",
                        "conclude"
                      ]
                    },
                    "target_role": {
                      "type": "string",
                      "enum": [
                        "map",
                        "territory",
                        "route",
                        "portrait",
                        "archival_photo",
                        "document",
                        "headline",
                        "date",
                        "text",
                        "callout",
                        "camera"
                      ]
                    },
                    "cue": {
                      "type": "object",
                      "additionalProperties": false,
                      "properties": {
                        "section_id": {
                          "type": "string",
                          "pattern": "^[A-Za-z][A-Za-z0-9_-]{2,63}$"
                        },
                        "phrase": {
                          "type": "string",
                          "minLength": 1,
                          "maxLength": 200
                        },
                        "occurrence": {
                          "type": "integer",
                          "minimum": 0,
                          "maximum": 100
                        }
                      },
                      "required": [
                        "section_id",
                        "phrase",
                        "occurrence"
                      ]
                    },
                    "priority": {
                      "type": "integer",
                      "minimum": 1,
                      "maximum": 5
                    }
                  },
                  "required": [
                    "beat_id",
                    "action",
                    "target_role",
                    "cue",
                    "priority"
                  ]
                },
                "minItems": 1
              },
              "asset_slots": {
                "type": "array",
                "items": {
                  "type": "object",
                  "additionalProperties": false,
                  "properties": {
                    "slot_id": {
                      "type": "string",
                      "pattern": "^[A-Za-z][A-Za-z0-9_-]{2,63}$"
                    },
                    "requirement_id": {
                      "type": "string",
                      "pattern": "^[A-Za-z][A-Za-z0-9_-]{2,63}$"
                    },
                    "semantic_role": {
                      "type": "string",
                      "minLength": 1,
                      "maxLength": 120
                    },
                    "usage": {
                      "type": "string",
                      "enum": [
                        "foreground",
                        "background",
                        "context",
                        "evidence"
                      ]
                    },
                    "mandatory": {
                      "type": "boolean"
                    }
                  },
                  "required": [
                    "slot_id",
                    "requirement_id",
                    "semantic_role",
                    "usage",
                    "mandatory"
                  ]
                },
                "minItems": 0
              },
              "camera_intent": {
                "type": "string",
                "enum": [
                  "static",
                  "pan",
                  "push_in",
                  "pull_out",
                  "track_route",
                  "compare_locked"
                ]
              },
              "composition_intent": {
                "type": "string",
                "enum": [
                  "left_subject",
                  "right_subject",
                  "center_hero",
                  "split_evidence",
                  "map_full",
                  "collage",
                  "chronology"
                ]
              },
              "emotional_tone": {
                "type": "string",
                "enum": [
                  "neutral",
                  "serious",
                  "tense",
                  "reflective",
                  "reveal"
                ]
              },
              "layout_variant_hint": {
                "type": "string",
                "enum": [
                  "A",
                  "B",
                  "C",
                  "AUTO"
                ]
              },
              "duration_policy": {
                "type": "string",
                "enum": [
                  "voice_locked",
                  "multi_section_hold"
                ]
              },
              "transition_intent": {
                "type": "string",
                "enum": [
                  "hard_cut",
                  "cross_dissolve",
                  "mask_reveal",
                  "match_cut"
                ]
              },
              "historical_map_requirement_id": {
                "anyOf": [
                  {
                    "type": "string",
                    "pattern": "^[A-Za-z][A-Za-z0-9_-]{2,63}$"
                  },
                  {
                    "type": "null"
                  }
                ]
              }
            },
            "required": [
              "visual_purpose",
              "viewer_takeaway",
              "on_screen_text",
              "reveal_plan",
              "asset_slots",
              "camera_intent",
              "composition_intent",
              "emotional_tone",
              "layout_variant_hint",
              "duration_policy",
              "transition_intent",
              "historical_map_requirement_id"
            ]
          }
        },
        "required": [
          "setup_id",
          "section_refs",
          "intent",
          "requirement_refs",
          "claim_refs",
          "direction"
        ]
      },
      "minItems": 1
    },
    "authoring_source": {
      "const": "external_chatgpt"
    }
  },
  "required": [
    "schema_version",
    "project",
    "sections",
    "claims",
    "asset_requirements",
    "visual_setups",
    "authoring_source"
  ],
  "description": "One external ChatGPT JSON contains script + sourcing leads + structured editorial direction for deterministic Storyboard Compiler. Direction contains no executable code or invented word timings."
}
