{
  "schema_version": "StoryPackage.v1",
  "project": {
    "project_id": "proj_001",
    "title": "Fixture: German history",
    "language": "en",
    "style_id": "HistoryEditorialPaper.v1"
  },
  "sections": [
    {
      "section_id": "sec_001",
      "narration": "In 1871, the German Empire was proclaimed.",
      "claim_refs": [
        "claim_001"
      ],
      "asset_requirement_refs": [
        "req_001"
      ]
    }
  ],
  "claims": [
    {
      "claim_id": "claim_001",
      "text": "Fixture claim. Source verification is pending.",
      "source_leads": [
        {
          "url": "https://example.org/fixture-record",
          "title": "Non-authoritative fixture URL"
        }
      ],
      "critical": false,
      "status": "UNVERIFIED"
    }
  ],
  "asset_requirements": [
    {
      "requirement_id": "req_001",
      "subject": "Period map for 1871 Germany",
      "asset_class": "HISTORICAL_MAP",
      "exactness": "subject_exact",
      "required": true,
      "start_year": 1871,
      "end_year": 1871,
      "source_leads": [],
      "map_reconstruction_policy": "exact_period_map"
    }
  ],
  "visual_setups": [
    {
      "setup_id": "setup_001",
      "section_refs": [
        "sec_001"
      ],
      "intent": "geography",
      "preferred_template": "T01",
      "requirement_refs": [
        "req_001"
      ],
      "claim_refs": [
        "claim_001"
      ],
      "direction": {
        "visual_purpose": "Establish the historical geography context with precise visual hierarchy",
        "viewer_takeaway": "Understand who, where and why this context matters",
        "on_screen_text": [
          {
            "text": "GERMANY 1871",
            "role": "headline",
            "claim_ref": null,
            "max_lines": 2
          }
        ],
        "reveal_plan": [
          {
            "beat_id": "beat_sec_001",
            "action": "establish",
            "target_role": "map",
            "cue": {
              "section_id": "sec_001",
              "phrase": "In",
              "occurrence": 0
            },
            "priority": 1
          }
        ],
        "asset_slots": [
          {
            "slot_id": "slot_sec_001",
            "requirement_id": "req_001",
            "semantic_role": "reviewed primary contextual evidence",
            "usage": "background",
            "mandatory": true
          }
        ],
        "camera_intent": "push_in",
        "composition_intent": "map_full",
        "emotional_tone": "neutral",
        "layout_variant_hint": "A",
        "duration_policy": "voice_locked",
        "transition_intent": "hard_cut",
        "historical_map_requirement_id": "req_001"
      }
    }
  ],
  "authoring_source": "external_chatgpt"
}
